20:46:47.608209 IP lamp-s-1vcpu-1gb-tor1-01.ssh > 198.96.84.204.51883: Flags [P.], seq 2723300:2723472, ack 1549, win 315, length 172
20:46:47.608309 IP lamp-s-1vcpu-1gb-tor1-01.ssh > 198.96.84.204.51883: Flags [P.], seq 2723472:2723644, ack 1549, win 315, length 172
20:46:47.608408 IP lamp-s-1vcpu-1gb-tor1-01.ssh > 198.96.84.204.51883: Flags [P.], seq 2723644:2723816, ack 1549, win 315, length 172
20:46:47.608537 IP lamp-s-1vcpu-1gb-tor1-01.ssh > 198.96.84.204.51883: Flags [P.], seq 2723816:2723988, ack 1549, win 315, length 172
20:46:47.608648 IP lamp-s-1vcpu-1gb-tor1-01.ssh > 198.96.84.204.51883: Flags [P.], seq 2723988:2724160, ack 1549, win 315, length 172
20:46:47.608689 IP 198.96.84.204.51883 > lamp-s-1vcpu-1gb-tor1-01.ssh: Flags [.], ack 2717452, win 508, length 0
20:46:47.608705 IP 198.96.84.204.51883 > lamp-s-1vcpu-1gb-tor1-01.ssh: Flags [.], ack 2717968, win 512, length 0
20:46:47.608711 IP 198.96.84.204.51883 > lamp-s-1vcpu-1gb-tor1-01.ssh: Flags [.], ack 2719172, win 508, length 0
20:46:47.608717 IP 198.96.84.204.51883 > lamp-s-1vcpu-1gb-tor1-01.ssh: Flags [.], ack 2720032, win 512, length 0
20:46:47.608892 IP lamp-s-1vcpu-1gb-tor1-01.ssh > 198.96.84.204.51883: Flags [P.], seq 2724160:2724788, ack 1549, win 315, length 628
20:46:47.609003 IP lamp-s-1vcpu-1gb-tor1-01.ssh > 198.96.84.204.51883: Flags [P.], seq 2724788:2724960, ack 1549, win 315, length 172
20:46:47.609103 IP lamp-s-1vcpu-1gb-tor1-01.ssh > 198.96.84.204.51883: Flags [P.], seq 2724960:2725132, ack 1549, win 315, length 172
20:46:47.609201 IP lamp-s-1vcpu-1gb-tor1-01.ssh > 198.96.84.204.51883: Flags [P.], seq 2725132:2725304, ack 1549, win 315, length 172
20:46:47.609300 IP lamp-s-1vcpu-1gb-tor1-01.ssh > 198.96.84.204.51883: Flags [P.], seq 2725304:2725476, ack 1549, win 315, length 172
20:46:47.609399 IP lamp-s-1vcpu-1gb-tor1-01.ssh > 198.96.84.204.51883: Flags [P.], seq 2725476:2725648, ack 1549, win 315, length 172
20:46:47.609498 IP lamp-s-1vcpu-1gb-tor1-01.ssh > 198.96.84.204.51883: Flags [P.], seq 2725648:2725820, ack 1549, win 315, length 172
20:46:47.609598 IP lamp-s-1vcpu-1gb-tor1-01.ssh > 198.96.84.204.51883: Flags [P.], seq 2725820:2725992, ack 1549, win 315, length 172
20:46:47.609697 IP lamp-s-1vcpu-1gb-tor1-01.ssh > 198.96.84.204.51883: Flags [P.], seq 2725992:2726164, ack 1549, win 315, length 172
20:46:47.609797 IP lamp-s-1vcpu-1gb-tor1-01.ssh > 198.96.84.204.51883: Flags [P.], seq 2726164:2726336, ack 1549, win 315, length 172
20:46:47.609897 IP lamp-s-1vcpu-1gb-tor1-01.ssh > 198.96.84.204.51883: Flags [P.], seq 2726336:2726508, ack 1549, win 315, length 172
20:46:47.609996 IP lamp-s-1vcpu-1gb-tor1-01.ssh > 198.96.84.204.51883: Flags [P.], seq 2726508:2726680, ack 1549, win 315, length 172
20:46:47.610094 IP lamp-s-1vcpu-1gb-tor1-01.ssh > 198.96.84.204.51883: Flags [P.], seq 2726680:2726852, ack 1549, win 315, length 172
20:46:47.610193 IP lamp-s-1vcpu-1gb-tor1-01.ssh > 198.96.84.204.51883: Flags [P.], seq 2726852:2727024, ack 1549, win 315, length 172
20:46:47.610292 IP lamp-s-1vcpu-1gb-tor1-01.ssh > 198.96.84.204.51883: Flags [P.], seq 2727024:2727196, ack 1549, win 315, length 172
20:46:47.610391 IP lamp-s-1vcpu-1gb-tor1-01.ssh > 198.96.84.204.51883: Flags [P.], seq 2727196:2727368, ack 1549, win 315, length 172
20:46:47.610511 IP lamp-s-1vcpu-1gb-tor1-01.ssh > 198.96.84.204.51883: Flags [P.], seq 2727368:2727540, ack 1549, win 315, length 172
20:46:47.610646 IP 198.96.84.204.51883 > lamp-s-1vcpu-1gb-tor1-01.ssh: Flags [.], ack 2721064, win 508, length 0
20:46:47.610667 IP 198.96.84.204.51883 > lamp-s-1vcpu-1gb-tor1-01.ssh: Flags [.], ack 2721924, win 512, length 0
20:46:47.610673 IP 198.96.84.204.51883 > lamp-s-1vcpu-1gb-tor1-01.ssh: Flags [.], ack 2722612, win 510, length 0
20:46:47.610850 IP lamp-s-1vcpu-1gb-tor1-01.ssh > 198.96.84.204.51883: Flags [P.], seq 2727540:2728056, ack 1549, win 315, length 516
20:46:47.610962 IP lamp-s-1vcpu-1gb-tor1-01.ssh > 198.96.84.204.51883: Flags [P.], seq 2728056:2728228, ack 1549, win 315, length 172
20:46:47.611064 IP lamp-s-1vcpu-1gb-tor1-01.ssh > 198.96.84.204.51883: Flags [P.], seq 2728228:2728400, ack 1549, win 315, length 172
20:46:47.611165 IP lamp-s-1vcpu-1gb-tor1-01.ssh > 198.96.84.204.51883: Flags [P.], seq 2728400:2728572, ack 1549, win 315, length 172
20:46:47.611265 IP lamp-s-1vcpu-1gb-tor1-01.ssh > 198.96.84.204.51883: Flags [P.], seq 2728572:2728744, ack 1549, win 315, length 172
20:46:47.611365 IP lamp-s-1vcpu-1gb-tor1-01.ssh > 198.96.84.204.51883: Flags [P.], seq 2728744:2728916, ack 1549, win 315, length 172
20:46:47.611467 IP lamp-s-1vcpu-1gb-tor1-01.ssh > 198.96.84.204.51883: Flags [P.], seq 2728916:2729088, ack 1549, win 315, length 172
20:46:47.611567 IP lamp-s-1vcpu-1gb-tor1-01.ssh > 198.96.84.204.51883: Flags [P.], seq 2729088:2729260, ack 1549, win 315, length 172
20:46:47.611666 IP lamp-s-1vcpu-1gb-tor1-01.ssh > 198.96.84.204.51883: Flags [P.], seq 2729260:2729432, ack 1549, win 315, length 172
20:46:47.611766 IP lamp-s-1vcpu-1gb-tor1-01.ssh > 198.96.84.204.51883: Flags [P.], seq 2729432:2729604, ack 1549, win 315, length 172
20:46:47.611866 IP lamp-s-1vcpu-1gb-tor1-01.ssh > 198.96.84.204.51883: Flags [P.], seq 2729604:2729776, ack 1549, win 315, length 172
20:46:47.611966 IP lamp-s-1vcpu-1gb-tor1-01.ssh > 198.96.84.204.51883: Flags [P.], seq 2729776:2729948, ack 1549, win 315, length 172
20:46:47.612066 IP lamp-s-1vcpu-1gb-tor1-01.ssh > 198.96.84.204.51883: Flags [P.], seq 2729948:2730120, ack 1549, win 315, length 172
20:46:47.612166 IP lamp-s-1vcpu-1gb-tor1-01.ssh > 198.96.84.204.51883: Flags [P.], seq 2730120:2730292, ack 1549, win 315, length 172
20:46:47.612266 IP lamp-s-1vcpu-1gb-tor1-01.ssh > 198.96.84.204.51883: Flags [P.], seq 2730292:2730464, ack 1549, win 315, length 172
20:46:47.612365 IP lamp-s-1vcpu-1gb-tor1-01.ssh > 198.96.84.204.51883: Flags [P.], seq 2730464:2730636, ack 1549, win 315, length 172
20:46:47.612484 IP lamp-s-1vcpu-1gb-tor1-01.ssh > 198.96.84.204.51883: Flags [P.], seq 2730636:2730808, ack 1549, win 315, length 172
20:46:47.612545 IP 198.96.84.204.51883 > lamp-s-1vcpu-1gb-tor1-01.ssh: Flags [.], ack 2723644, win 512, length 0
20:46:47.612573 IP 198.96.84.204.51883 > lamp-s-1vcpu-1gb-tor1-01.ssh: Flags [.], ack 2724788, win 508, length 0
20:46:47.612589 IP 198.96.84.204.51883 > lamp-s-1vcpu-1gb-tor1-01.ssh: Flags [.], ack 2725476, win 512, length 0
20:46:47.612600 IP 198.96.84.204.51883 > lamp-s-1vcpu-1gb-tor1-01.ssh: Flags [.], ack 2726164, win 510, length 0
20:46:47.612609 IP 198.96.84.204.51883 > lamp-s-1vcpu-1gb-tor1-01.ssh: Flags [.], ack 2727196, win 512, length 0
20:46:47.612813 IP lamp-s-1vcpu-1gb-tor1-01.ssh > 198.96.84.204.51883: Flags [P.], seq 2730808:2731548, ack 1549, win 315, length 740
20:46:47.612933 IP lamp-s-1vcpu-1gb-tor1-01.ssh > 198.96.84.204.51883: Flags [P.], seq 2731548:2731720, ack 1549, win 315, length 172
20:46:47.613036 IP lamp-s-1vcpu-1gb-tor1-01.ssh > 198.96.84.204.51883: Flags [P.], seq 2731720:2731892, ack 1549, win 315, length 172
20:46:47.613136 IP lamp-s-1vcpu-1gb-tor1-01.ssh > 198.96.84.204.51883: Flags [P.], seq 2731892:2732064, ack 1549, win 315, length 172
20:46:47.613235 IP lamp-s-1vcpu-1gb-tor1-01.ssh > 198.96.84.204.51883: Flags [P.], seq 2732064:2732236, ack 1549, win 315, length 172
20:46:47.613335 IP lamp-s-1vcpu-1gb-tor1-01.ssh > 198.96.84.204.51883: Flags [P.], seq 2732236:2732408, ack 1549, win 315, length 172
20:46:47.613435 IP lamp-s-1vcpu-1gb-tor1-01.ssh > 198.96.84.204.51883: Flags [P.], seq 2732408:2732580, ack 1549, win 315, length 172
20:46:47.613536 IP lamp-s-1vcpu-1gb-tor1-01.ssh > 198.96.84.204.51883: Flags [P.], seq 2732580:2732752, ack 1549, win 315, length 172
20:46:47.613636 IP lamp-s-1vcpu-1gb-tor1-01.ssh > 198.96.84.204.51883: Flags [P.], seq 2732752:2732924, ack 1549, win 315, length 172
20:46:47.613736 IP lamp-s-1vcpu-1gb-tor1-01.ssh > 198.96.84.204.51883: Flags [P.], seq 2732924:2733096, ack 1549, win 315, length 172
20:46:47.613835 IP lamp-s-1vcpu-1gb-tor1-01.ssh > 198.96.84.204.51883: Flags [P.], seq 2733096:2733268, ack 1549, win 315, length 172
20:46:47.613935 IP lamp-s-1vcpu-1gb-tor1-01.ssh > 198.96.84.204.51883: Flags [P.], seq 2733268:2733440, ack 1549, win 315, length 172
20:46:47.614036 IP lamp-s-1vcpu-1gb-tor1-01.ssh > 198.96.84.204.51883: Flags [P.], seq 2733440:2733612, ack 1549, win 315, length 172
20:46:47.614136 IP lamp-s-1vcpu-1gb-tor1-01.ssh > 198.96.84.204.51883: Flags [P.], seq 2733612:2733784, ack 1549, win 315, length 172
20:46:47.614234 IP 198.96.84.204.51883 > lamp-s-1vcpu-1gb-tor1-01.ssh: Flags [.], ack 2727540, win 511, length 0
20:46:47.614250 IP 198.96.84.204.51883 > lamp-s-1vcpu-1gb-tor1-01.ssh: Flags [.], ack 2728572, win 512, length 0
20:46:47.614256 IP 198.96.84.204.51883 > lamp-s-1vcpu-1gb-tor1-01.ssh: Flags [.], ack 2729260, win 510, length 0
20:46:47.614370 IP lamp-s-1vcpu-1gb-tor1-01.ssh > 198.96.84.204.51883: Flags [P.], seq 2733784:2733956, ack 1549, win 315, length 172
20:46:47.614471 IP lamp-s-1vcpu-1gb-tor1-01.ssh > 198.96.84.204.51883: Flags [P.], seq 2733956:2734336, ack 1549, win 315, length 380
20:46:47.614563 IP lamp-s-1vcpu-1gb-tor1-01.ssh > 198.96.84.204.51883: Flags [P.], seq 2734336:2734508, ack 1549, win 315, length 172
20:46:47.614654 IP lamp-s-1vcpu-1gb-tor1-01.ssh > 198.96.84.204.51883: Flags [P.], seq 2734508:2734680, ack 1549, win 315, length 172
20:46:47.614744 IP lamp-s-1vcpu-1gb-tor1-01.ssh > 198.96.84.204.51883: Flags [P.], seq 2734680:2734852, ack 1549, win 315, length 172
20:46:47.614812 IP lamp-s-1vcpu-1gb-tor1-01.ssh > 198.96.84.204.51883: Flags [P.], seq 2734852:2735024, ack 1549, win 315, length 172
20:46:47.614936 IP lamp-s-1vcpu-1gb-tor1-01.ssh > 198.96.84.204.51883: Flags [P.], seq 2735024:2735332, ack 1549, win 315, length 308
20:46:47.615039 IP lamp-s-1vcpu-1gb-tor1-01.ssh > 198.96.84.204.51883: Flags [P.], seq 2735332:2735504, ack 1549, win 315, length 172
20:46:47.615141 IP lamp-s-1vcpu-1gb-tor1-01.ssh > 198.96.84.204.51883: Flags [P.], seq 2735504:2735676, ack 1549, win 315, length 172
20:46:47.615242 IP lamp-s-1vcpu-1gb-tor1-01.ssh > 198.96.84.204.51883: Flags [P.], seq 2735676:2735848, ack 1549, win 315, length 172
20:46:47.615341 IP lamp-s-1vcpu-1gb-tor1-01.ssh > 198.96.84.204.51883: Flags [P.], seq 2735848:2736020, ack 1549, win 315, length 172
20:46:47.615440 IP lamp-s-1vcpu-1gb-tor1-01.ssh > 198.96.84.204.51883: Flags [P.], seq 2736020:2736192, ack 1549, win 315, length 172
20:46:47.615597 IP lamp-s-1vcpu-1gb-tor1-01.ssh > 198.96.84.204.51883: Flags [P.], seq 2736192:2736364, ack 1549, win 315, length 172
20:46:47.615729 IP lamp-s-1vcpu-1gb-tor1-01.ssh > 198.96.84.204.51883: Flags [P.], seq 2736364:2736536, ack 1549, win 315, length 172
20:46:47.615777 IP 198.96.84.204.51883 > lamp-s-1vcpu-1gb-tor1-01.ssh: Flags [.], ack 2730292, win 512, length 0
20:46:47.615809 IP 198.96.84.204.51883 > lamp-s-1vcpu-1gb-tor1-01.ssh: Flags [.], ack 2730808, win 510, length 0
20:46:47.615815 IP 198.96.84.204.51883 > lamp-s-1vcpu-1gb-tor1-01.ssh: Flags [.], ack 2732064, win 512, length 0
20:46:47.615969 IP lamp-s-1vcpu-1gb-tor1-01.ssh > 198.96.84.204.51883: Flags [P.], seq 2736536:2737052, ack 1549, win 315, length 516
20:46:47.616078 IP lamp-s-1vcpu-1gb-tor1-01.ssh > 198.96.84.204.51883: Flags [P.], seq 2737052:2737224, ack 1549, win 315, length 172
20:46:47.616180 IP lamp-s-1vcpu-1gb-tor1-01.ssh > 198.96.84.204.51883: Flags [P.], seq 2737224:2737396, ack 1549, win 315, length 172
20:46:47.616280 IP lamp-s-1vcpu-1gb-tor1-01.ssh > 198.96.84.204.51883: Flags [P.], seq 2737396:2737568, ack 1549, win 315, length 172
20:46:47.616379 IP lamp-s-1vcpu-1gb-tor1-01.ssh > 198.96.84.204.51883: Flags [P.], seq 2737568:2737740, ack 1549, win 315, length 172
20:46:47.616534 IP lamp-s-1vcpu-1gb-tor1-01.ssh > 198.96.84.204.51883: Flags [P.], seq 2737740:2737912, ack 1549, win 315, length 172
20:46:47.616689 IP lamp-s-1vcpu-1gb-tor1-01.ssh > 198.96.84.204.51883: Flags [P.], seq 2737912:2738084, ack 1549, win 315, length 172
20:46:47.616805 IP lamp-s-1vcpu-1gb-tor1-01.ssh > 198.96.84.204.51883: Flags [P.], seq 2738084:2738256, ack 1549, win 315, length 172
20:46:47.616909 IP lamp-s-1vcpu-1gb-tor1-01.ssh > 198.96.84.204.51883: Flags [P.], seq 2738256:2738428, ack 1549, win 315, length 172
20:46:47.617016 IP lamp-s-1vcpu-1gb-tor1-01.ssh > 198.96.84.204.51883: Flags [P.], seq 2738428:2738600, ack 1549, win 315, length 172
20:46:47.617120 IP lamp-s-1vcpu-1gb-tor1-01.ssh > 198.96.84.204.51883: Flags [P.], seq 2738600:2738772, ack 1549, win 315, length 172
20:46:47.617234 IP lamp-s-1vcpu-1gb-tor1-01.ssh > 198.96.84.204.51883: Flags [P.], seq 2738772:2738944, ack 1549, win 315, length 172
20:46:47.617337 IP lamp-s-1vcpu-1gb-tor1-01.ssh > 198.96.84.204.51883: Flags [P.], seq 2738944:2739116, ack 1549, win 315, length 172
20:46:47.617444 IP lamp-s-1vcpu-1gb-tor1-01.ssh > 198.96.84.204.51883: Flags [P.], seq 2739116:2739288, ack 1549, win 315, length 172
20:46:47.617607 IP lamp-s-1vcpu-1gb-tor1-01.ssh > 198.96.84.204.51883: Flags [P.], seq 2739288:2739460, ack 1549, win 315, length 172
20:46:47.617742 IP lamp-s-1vcpu-1gb-tor1-01.ssh > 198.96.84.204.51883: Flags [P.], seq 2739460:2739632, ack 1549, win 315, length 172
20:46:47.617850 IP lamp-s-1vcpu-1gb-tor1-01.ssh > 198.96.84.204.51883: Flags [P.], seq 2739632:2739804, ack 1549, win 315, length 172
20:46:47.617932 IP 198.96.84.204.51883 > lamp-s-1vcpu-1gb-tor1-01.ssh: Flags [.], ack 2733268, win 508, length 0
20:46:47.617953 IP 198.96.84.204.51883 > lamp-s-1vcpu-1gb-tor1-01.ssh: Flags [.], ack 2733784, win 512, length 0
20:46:47.617960 IP 198.96.84.204.51883 > lamp-s-1vcpu-1gb-tor1-01.ssh: Flags [.], ack 2735024, win 508, length 0
20:46:47.618094 IP lamp-s-1vcpu-1gb-tor1-01.ssh > 198.96.84.204.51883: Flags [P.], seq 2739804:2740320, ack 1549, win 315, length 516
20:46:47.618211 IP lamp-s-1vcpu-1gb-tor1-01.ssh > 198.96.84.204.51883: Flags [P.], seq 2740320:2740492, ack 1549, win 315, length 172
20:46:47.618314 IP lamp-s-1vcpu-1gb-tor1-01.ssh > 198.96.84.204.51883: Flags [P.], seq 2740492:2740664, ack 1549, win 315, length 172
20:46:47.618422 IP lamp-s-1vcpu-1gb-tor1-01.ssh > 198.96.84.204.51883: Flags [P.], seq 2740664:2740836, ack 1549, win 315, length 172
20:46:47.618524 IP lamp-s-1vcpu-1gb-tor1-01.ssh > 198.96.84.204.51883: Flags [P.], seq 2740836:2741008, ack 1549, win 315, length 172
20:46:47.618673 IP lamp-s-1vcpu-1gb-tor1-01.ssh > 198.96.84.204.51883: Flags [P.], seq 2741008:2741180, ack 1549, win 315, length 172
20:46:47.618903 IP lamp-s-1vcpu-1gb-tor1-01.ssh > 198.96.84.204.51883: Flags [P.], seq 2741180:2741352, ack 1549, win 315, length 172
20:46:47.619026 IP lamp-s-1vcpu-1gb-tor1-01.ssh > 198.96.84.204.51883: Flags [P.], seq 2741352:2741524, ack 1549, win 315, length 172
20:46:47.619130 IP lamp-s-1vcpu-1gb-tor1-01.ssh > 198.96.84.204.51883: Flags [P.], seq 2741524:2741696, ack 1549, win 315, length 172
20:46:47.619232 IP lamp-s-1vcpu-1gb-tor1-01.ssh > 198.96.84.204.51883: Flags [P.], seq 2741696:2741868, ack 1549, win 315, length 172
20:46:47.619334 IP lamp-s-1vcpu-1gb-tor1-01.ssh > 198.96.84.204.51883: Flags [P.], seq 2741868:2742040, ack 1549, win 315, length 172
20:46:47.619435 IP lamp-s-1vcpu-1gb-tor1-01.ssh > 198.96.84.204.51883: Flags [P.], seq 2742040:2742212, ack 1549, win 315, length 172
20:46:47.619495 IP 198.96.84.204.51883 > lamp-s-1vcpu-1gb-tor1-01.ssh: Flags [.], ack 2736192, win 512, length 0
20:46:47.619513 IP 198.96.84.204.51883 > lamp-s-1vcpu-1gb-tor1-01.ssh: Flags [.], ack 2737224, win 508, length 0
20:46:47.619520 IP 198.96.84.204.51883 > lamp-s-1vcpu-1gb-tor1-01.ssh: Flags [.], ack 2737740, win 512, length 0
20:46:47.619525 IP 198.96.84.204.51883 > lamp-s-1vcpu-1gb-tor1-01.ssh: Flags [P.], seq 1549:1585, ack 2737740, win 512, length 36
20:46:47.619531 IP 198.96.84.204.51883 > lamp-s-1vcpu-1gb-tor1-01.ssh: Flags [.], ack 2738428, win 510, length 0
20:46:47.619538 IP 198.96.84.204.51883 > lamp-s-1vcpu-1gb-tor1-01.ssh: Flags [.], ack 2739288, win 512, length 0
^C
16743 packets captured
16871 packets received by filter
128 packets dropped by kernel
