20:59:59.966706 IP lamp-s-1vcpu-1gb-tor1-01.ssh > 198.96.84.204.51883: Flags [P.], seq 1774668:1774840, ack 1009, win 315, length 172
20:59:59.966841 IP lamp-s-1vcpu-1gb-tor1-01.ssh > 198.96.84.204.51883: Flags [P.], seq 1774840:1775012, ack 1009, win 315, length 172
20:59:59.966946 IP lamp-s-1vcpu-1gb-tor1-01.ssh > 198.96.84.204.51883: Flags [P.], seq 1775012:1775184, ack 1009, win 315, length 172
20:59:59.967046 IP lamp-s-1vcpu-1gb-tor1-01.ssh > 198.96.84.204.51883: Flags [P.], seq 1775184:1775356, ack 1009, win 315, length 172
20:59:59.967145 IP lamp-s-1vcpu-1gb-tor1-01.ssh > 198.96.84.204.51883: Flags [P.], seq 1775356:1775528, ack 1009, win 315, length 172
20:59:59.967245 IP lamp-s-1vcpu-1gb-tor1-01.ssh > 198.96.84.204.51883: Flags [P.], seq 1775528:1775700, ack 1009, win 315, length 172
20:59:59.967345 IP lamp-s-1vcpu-1gb-tor1-01.ssh > 198.96.84.204.51883: Flags [P.], seq 1775700:1775872, ack 1009, win 315, length 172
20:59:59.967446 IP lamp-s-1vcpu-1gb-tor1-01.ssh > 198.96.84.204.51883: Flags [P.], seq 1775872:1776044, ack 1009, win 315, length 172
20:59:59.967545 IP lamp-s-1vcpu-1gb-tor1-01.ssh > 198.96.84.204.51883: Flags [P.], seq 1776044:1776216, ack 1009, win 315, length 172
20:59:59.967645 IP lamp-s-1vcpu-1gb-tor1-01.ssh > 198.96.84.204.51883: Flags [P.], seq 1776216:1776388, ack 1009, win 315, length 172
20:59:59.967745 IP lamp-s-1vcpu-1gb-tor1-01.ssh > 198.96.84.204.51883: Flags [P.], seq 1776388:1776560, ack 1009, win 315, length 172
20:59:59.967845 IP lamp-s-1vcpu-1gb-tor1-01.ssh > 198.96.84.204.51883: Flags [P.], seq 1776560:1776732, ack 1009, win 315, length 172
20:59:59.967944 IP lamp-s-1vcpu-1gb-tor1-01.ssh > 198.96.84.204.51883: Flags [P.], seq 1776732:1776904, ack 1009, win 315, length 172
20:59:59.968044 IP lamp-s-1vcpu-1gb-tor1-01.ssh > 198.96.84.204.51883: Flags [P.], seq 1776904:1777076, ack 1009, win 315, length 172
20:59:59.968147 IP lamp-s-1vcpu-1gb-tor1-01.ssh > 198.96.84.204.51883: Flags [P.], seq 1777076:1777248, ack 1009, win 315, length 172
20:59:59.968248 IP lamp-s-1vcpu-1gb-tor1-01.ssh > 198.96.84.204.51883: Flags [P.], seq 1777248:1777420, ack 1009, win 315, length 172
20:59:59.968376 IP lamp-s-1vcpu-1gb-tor1-01.ssh > 198.96.84.204.51883: Flags [P.], seq 1777420:1777592, ack 1009, win 315, length 172
20:59:59.968482 IP lamp-s-1vcpu-1gb-tor1-01.ssh > 198.96.84.204.51883: Flags [P.], seq 1777592:1777764, ack 1009, win 315, length 172
20:59:59.968585 IP lamp-s-1vcpu-1gb-tor1-01.ssh > 198.96.84.204.51883: Flags [P.], seq 1777764:1777936, ack 1009, win 315, length 172
20:59:59.968646 IP 198.96.84.204.51883 > lamp-s-1vcpu-1gb-tor1-01.ssh: Flags [.], ack 1770548, win 510, length 0
20:59:59.968663 IP 198.96.84.204.51883 > lamp-s-1vcpu-1gb-tor1-01.ssh: Flags [.], ack 1771176, win 508, length 0
20:59:59.968668 IP 198.96.84.204.51883 > lamp-s-1vcpu-1gb-tor1-01.ssh: Flags [P.], seq 1009:1045, ack 1771176, win 508, length 36
20:59:59.968674 IP 198.96.84.204.51883 > lamp-s-1vcpu-1gb-tor1-01.ssh: Flags [.], ack 1771348, win 512, length 0
20:59:59.968680 IP 198.96.84.204.51883 > lamp-s-1vcpu-1gb-tor1-01.ssh: Flags [.], ack 1772036, win 510, length 0
20:59:59.968686 IP 198.96.84.204.51883 > lamp-s-1vcpu-1gb-tor1-01.ssh: Flags [.], ack 1773068, win 512, length 0
20:59:59.968891 IP lamp-s-1vcpu-1gb-tor1-01.ssh > 198.96.84.204.51883: Flags [P.], seq 1777936:1778812, ack 1045, win 315, length 876
20:59:59.969006 IP lamp-s-1vcpu-1gb-tor1-01.ssh > 198.96.84.204.51883: Flags [P.], seq 1778812:1778984, ack 1045, win 315, length 172
20:59:59.969108 IP lamp-s-1vcpu-1gb-tor1-01.ssh > 198.96.84.204.51883: Flags [P.], seq 1778984:1779156, ack 1045, win 315, length 172
20:59:59.969209 IP lamp-s-1vcpu-1gb-tor1-01.ssh > 198.96.84.204.51883: Flags [P.], seq 1779156:1779328, ack 1045, win 315, length 172
20:59:59.969308 IP lamp-s-1vcpu-1gb-tor1-01.ssh > 198.96.84.204.51883: Flags [P.], seq 1779328:1779500, ack 1045, win 315, length 172
20:59:59.969407 IP lamp-s-1vcpu-1gb-tor1-01.ssh > 198.96.84.204.51883: Flags [P.], seq 1779500:1779672, ack 1045, win 315, length 172
20:59:59.969507 IP lamp-s-1vcpu-1gb-tor1-01.ssh > 198.96.84.204.51883: Flags [P.], seq 1779672:1779844, ack 1045, win 315, length 172
20:59:59.969610 IP lamp-s-1vcpu-1gb-tor1-01.ssh > 198.96.84.204.51883: Flags [P.], seq 1779844:1780016, ack 1045, win 315, length 172
20:59:59.969710 IP lamp-s-1vcpu-1gb-tor1-01.ssh > 198.96.84.204.51883: Flags [P.], seq 1780016:1780188, ack 1045, win 315, length 172
20:59:59.969812 IP lamp-s-1vcpu-1gb-tor1-01.ssh > 198.96.84.204.51883: Flags [P.], seq 1780188:1780360, ack 1045, win 315, length 172
20:59:59.969912 IP lamp-s-1vcpu-1gb-tor1-01.ssh > 198.96.84.204.51883: Flags [P.], seq 1780360:1780532, ack 1045, win 315, length 172
20:59:59.970012 IP lamp-s-1vcpu-1gb-tor1-01.ssh > 198.96.84.204.51883: Flags [P.], seq 1780532:1780704, ack 1045, win 315, length 172
20:59:59.970110 IP lamp-s-1vcpu-1gb-tor1-01.ssh > 198.96.84.204.51883: Flags [P.], seq 1780704:1780876, ack 1045, win 315, length 172
20:59:59.970209 IP lamp-s-1vcpu-1gb-tor1-01.ssh > 198.96.84.204.51883: Flags [P.], seq 1780876:1781048, ack 1045, win 315, length 172
20:59:59.970308 IP lamp-s-1vcpu-1gb-tor1-01.ssh > 198.96.84.204.51883: Flags [P.], seq 1781048:1781220, ack 1045, win 315, length 172
20:59:59.970407 IP lamp-s-1vcpu-1gb-tor1-01.ssh > 198.96.84.204.51883: Flags [P.], seq 1781220:1781392, ack 1045, win 315, length 172
20:59:59.970508 IP lamp-s-1vcpu-1gb-tor1-01.ssh > 198.96.84.204.51883: Flags [P.], seq 1781392:1781564, ack 1045, win 315, length 172
20:59:59.970609 IP lamp-s-1vcpu-1gb-tor1-01.ssh > 198.96.84.204.51883: Flags [P.], seq 1781564:1781736, ack 1045, win 315, length 172
20:59:59.970709 IP lamp-s-1vcpu-1gb-tor1-01.ssh > 198.96.84.204.51883: Flags [P.], seq 1781736:1781908, ack 1045, win 315, length 172
20:59:59.970845 IP lamp-s-1vcpu-1gb-tor1-01.ssh > 198.96.84.204.51883: Flags [P.], seq 1781908:1782080, ack 1045, win 315, length 172
20:59:59.970951 IP lamp-s-1vcpu-1gb-tor1-01.ssh > 198.96.84.204.51883: Flags [P.], seq 1782080:1782252, ack 1045, win 315, length 172
20:59:59.971051 IP lamp-s-1vcpu-1gb-tor1-01.ssh > 198.96.84.204.51883: Flags [P.], seq 1782252:1782424, ack 1045, win 315, length 172
20:59:59.971152 IP lamp-s-1vcpu-1gb-tor1-01.ssh > 198.96.84.204.51883: Flags [P.], seq 1782424:1782596, ack 1045, win 315, length 172
20:59:59.971253 IP lamp-s-1vcpu-1gb-tor1-01.ssh > 198.96.84.204.51883: Flags [P.], seq 1782596:1782768, ack 1045, win 315, length 172
20:59:59.971353 IP lamp-s-1vcpu-1gb-tor1-01.ssh > 198.96.84.204.51883: Flags [P.], seq 1782768:1782940, ack 1045, win 315, length 172
20:59:59.971456 IP lamp-s-1vcpu-1gb-tor1-01.ssh > 198.96.84.204.51883: Flags [P.], seq 1782940:1783112, ack 1045, win 315, length 172
20:59:59.971565 IP lamp-s-1vcpu-1gb-tor1-01.ssh > 198.96.84.204.51883: Flags [P.], seq 1783112:1783284, ack 1045, win 315, length 172
20:59:59.971668 IP lamp-s-1vcpu-1gb-tor1-01.ssh > 198.96.84.204.51883: Flags [P.], seq 1783284:1783456, ack 1045, win 315, length 172
20:59:59.971767 IP lamp-s-1vcpu-1gb-tor1-01.ssh > 198.96.84.204.51883: Flags [P.], seq 1783456:1783628, ack 1045, win 315, length 172
20:59:59.971866 IP lamp-s-1vcpu-1gb-tor1-01.ssh > 198.96.84.204.51883: Flags [P.], seq 1783628:1783800, ack 1045, win 315, length 172
20:59:59.973286 IP 198.96.84.204.51883 > lamp-s-1vcpu-1gb-tor1-01.ssh: Flags [P.], seq 1045:1081, ack 1773068, win 512, length 36
^C
10965 packets captured
11081 packets received by filter
116 packets dropped by kernel
