20:59:14.359096 IP 165.227.41.79.22 > 198.96.84.204.51883: Flags [P.], seq 2663616:2663780, ack 1513, win 315, length 164
20:59:14.359199 IP 165.227.41.79.22 > 198.96.84.204.51883: Flags [P.], seq 2663780:2663944, ack 1513, win 315, length 164
20:59:14.359299 IP 165.227.41.79.22 > 198.96.84.204.51883: Flags [P.], seq 2663944:2664108, ack 1513, win 315, length 164
20:59:14.359401 IP 165.227.41.79.22 > 198.96.84.204.51883: Flags [P.], seq 2664108:2664272, ack 1513, win 315, length 164
20:59:14.359503 IP 165.227.41.79.22 > 198.96.84.204.51883: Flags [P.], seq 2664272:2664436, ack 1513, win 315, length 164
20:59:14.359651 IP 165.227.41.79.22 > 198.96.84.204.51883: Flags [P.], seq 2664436:2664600, ack 1513, win 315, length 164
20:59:14.359796 IP 165.227.41.79.22 > 198.96.84.204.51883: Flags [P.], seq 2664600:2664764, ack 1513, win 315, length 164
20:59:14.359907 IP 165.227.41.79.22 > 198.96.84.204.51883: Flags [P.], seq 2664764:2664928, ack 1513, win 315, length 164
20:59:14.360009 IP 165.227.41.79.22 > 198.96.84.204.51883: Flags [P.], seq 2664928:2665092, ack 1513, win 315, length 164
20:59:14.360117 IP 165.227.41.79.22 > 198.96.84.204.51883: Flags [P.], seq 2665092:2665256, ack 1513, win 315, length 164
20:59:14.360221 IP 165.227.41.79.22 > 198.96.84.204.51883: Flags [P.], seq 2665256:2665420, ack 1513, win 315, length 164
20:59:14.360342 IP 165.227.41.79.22 > 198.96.84.204.51883: Flags [P.], seq 2665420:2665584, ack 1513, win 315, length 164
20:59:14.360420 IP 198.96.84.204.51883 > 165.227.41.79.22: Flags [.], ack 2660372, win 510, length 0
20:59:14.360437 IP 198.96.84.204.51883 > 165.227.41.79.22: Flags [.], ack 2660536, win 510, length 0
20:59:14.360442 IP 198.96.84.204.51883 > 165.227.41.79.22: Flags [.], ack 2661636, win 512, length 0
20:59:14.360448 IP 198.96.84.204.51883 > 165.227.41.79.22: Flags [.], ack 2662292, win 510, length 0
20:59:14.360599 IP 165.227.41.79.22 > 198.96.84.204.51883: Flags [P.], seq 2665584:2666156, ack 1513, win 315, length 572
20:59:14.360708 IP 165.227.41.79.22 > 198.96.84.204.51883: Flags [P.], seq 2666156:2666320, ack 1513, win 315, length 164
20:59:14.360810 IP 165.227.41.79.22 > 198.96.84.204.51883: Flags [P.], seq 2666320:2666484, ack 1513, win 315, length 164
20:59:14.360910 IP 165.227.41.79.22 > 198.96.84.204.51883: Flags [P.], seq 2666484:2666648, ack 1513, win 315, length 164
20:59:14.361011 IP 165.227.41.79.22 > 198.96.84.204.51883: Flags [P.], seq 2666648:2666812, ack 1513, win 315, length 164
20:59:14.361111 IP 165.227.41.79.22 > 198.96.84.204.51883: Flags [P.], seq 2666812:2666976, ack 1513, win 315, length 164
20:59:14.361212 IP 165.227.41.79.22 > 198.96.84.204.51883: Flags [P.], seq 2666976:2667140, ack 1513, win 315, length 164
20:59:14.361311 IP 165.227.41.79.22 > 198.96.84.204.51883: Flags [P.], seq 2667140:2667304, ack 1513, win 315, length 164
20:59:14.361411 IP 165.227.41.79.22 > 198.96.84.204.51883: Flags [P.], seq 2667304:2667468, ack 1513, win 315, length 164
20:59:14.361510 IP 165.227.41.79.22 > 198.96.84.204.51883: Flags [P.], seq 2667468:2667632, ack 1513, win 315, length 164
20:59:14.361612 IP 165.227.41.79.22 > 198.96.84.204.51883: Flags [P.], seq 2667632:2667796, ack 1513, win 315, length 164
20:59:14.361714 IP 165.227.41.79.22 > 198.96.84.204.51883: Flags [P.], seq 2667796:2667960, ack 1513, win 315, length 164
20:59:14.361814 IP 165.227.41.79.22 > 198.96.84.204.51883: Flags [P.], seq 2667960:2668124, ack 1513, win 315, length 164
20:59:14.361913 IP 165.227.41.79.22 > 198.96.84.204.51883: Flags [P.], seq 2668124:2668288, ack 1513, win 315, length 164
20:59:14.362013 IP 165.227.41.79.22 > 198.96.84.204.51883: Flags [P.], seq 2668288:2668452, ack 1513, win 315, length 164
20:59:14.362116 IP 198.96.84.204.51883 > 165.227.41.79.22: Flags [.], ack 2662784, win 508, length 0
20:59:14.362133 IP 198.96.84.204.51883 > 165.227.41.79.22: Flags [.], ack 2663780, win 512, length 0
20:59:14.362139 IP 198.96.84.204.51883 > 165.227.41.79.22: Flags [.], ack 2664272, win 510, length 0
20:59:14.362238 IP 165.227.41.79.22 > 198.96.84.204.51883: Flags [P.], seq 2668452:2668616, ack 1513, win 315, length 164
20:59:14.362348 IP 165.227.41.79.22 > 198.96.84.204.51883: Flags [P.], seq 2668616:2669084, ack 1513, win 315, length 468
20:59:14.362455 IP 165.227.41.79.22 > 198.96.84.204.51883: Flags [P.], seq 2669084:2669248, ack 1513, win 315, length 164
20:59:14.362617 IP 165.227.41.79.22 > 198.96.84.204.51883: Flags [P.], seq 2669248:2669412, ack 1513, win 315, length 164
20:59:14.362738 IP 165.227.41.79.22 > 198.96.84.204.51883: Flags [P.], seq 2669412:2669576, ack 1513, win 315, length 164
20:59:14.362872 IP 165.227.41.79.22 > 198.96.84.204.51883: Flags [P.], seq 2669576:2669740, ack 1513, win 315, length 164
20:59:14.362975 IP 165.227.41.79.22 > 198.96.84.204.51883: Flags [P.], seq 2669740:2669904, ack 1513, win 315, length 164
20:59:14.363076 IP 165.227.41.79.22 > 198.96.84.204.51883: Flags [P.], seq 2669904:2670068, ack 1513, win 315, length 164
20:59:14.363194 IP 165.227.41.79.22 > 198.96.84.204.51883: Flags [P.], seq 2670068:2670232, ack 1513, win 315, length 164
20:59:14.363335 IP 165.227.41.79.22 > 198.96.84.204.51883: Flags [P.], seq 2670232:2670396, ack 1513, win 315, length 164
20:59:14.363462 IP 165.227.41.79.22 > 198.96.84.204.51883: Flags [P.], seq 2670396:2670560, ack 1513, win 315, length 164
20:59:14.363579 IP 165.227.41.79.22 > 198.96.84.204.51883: Flags [P.], seq 2670560:2670724, ack 1513, win 315, length 164
20:59:14.363683 IP 165.227.41.79.22 > 198.96.84.204.51883: Flags [P.], seq 2670724:2670888, ack 1513, win 315, length 164
20:59:14.363789 IP 198.96.84.204.51883 > 165.227.41.79.22: Flags [.], ack 2664764, win 509, length 0
20:59:14.363867 IP 165.227.41.79.22 > 198.96.84.204.51883: Flags [P.], seq 2670888:2671052, ack 1513, win 315, length 164
20:59:14.363973 IP 165.227.41.79.22 > 198.96.84.204.51883: Flags [P.], seq 2671052:2671312, ack 1513, win 315, length 260
20:59:14.364088 IP 165.227.41.79.22 > 198.96.84.204.51883: Flags [P.], seq 2671312:2671476, ack 1513, win 315, length 164
20:59:14.364194 IP 165.227.41.79.22 > 198.96.84.204.51883: Flags [P.], seq 2671476:2671640, ack 1513, win 315, length 164
20:59:14.364295 IP 165.227.41.79.22 > 198.96.84.204.51883: Flags [P.], seq 2671640:2671804, ack 1513, win 315, length 164
20:59:14.364413 IP 165.227.41.79.22 > 198.96.84.204.51883: Flags [P.], seq 2671804:2671968, ack 1513, win 315, length 164
20:59:14.364578 IP 165.227.41.79.22 > 198.96.84.204.51883: Flags [P.], seq 2671968:2672132, ack 1513, win 315, length 164
20:59:14.364698 IP 165.227.41.79.22 > 198.96.84.204.51883: Flags [P.], seq 2672132:2672296, ack 1513, win 315, length 164
20:59:14.364803 IP 165.227.41.79.22 > 198.96.84.204.51883: Flags [P.], seq 2672296:2672460, ack 1513, win 315, length 164
20:59:14.364904 IP 165.227.41.79.22 > 198.96.84.204.51883: Flags [P.], seq 2672460:2672624, ack 1513, win 315, length 164
20:59:14.365033 IP 165.227.41.79.22 > 198.96.84.204.51883: Flags [P.], seq 2672624:2672788, ack 1513, win 315, length 164
20:59:14.365225 IP 165.227.41.79.22 > 198.96.84.204.51883: Flags [P.], seq 2672788:2672952, ack 1513, win 315, length 164
20:59:14.365358 IP 165.227.41.79.22 > 198.96.84.204.51883: Flags [P.], seq 2672952:2673116, ack 1513, win 315, length 164
20:59:14.365426 IP 198.96.84.204.51883 > 165.227.41.79.22: Flags [.], ack 2665420, win 512, length 0
20:59:14.365452 IP 198.96.84.204.51883 > 165.227.41.79.22: Flags [.], ack 2665584, win 512, length 0
20:59:14.365465 IP 198.96.84.204.51883 > 165.227.41.79.22: Flags [.], ack 2666484, win 508, length 0
20:59:14.365476 IP 198.96.84.204.51883 > 165.227.41.79.22: Flags [.], ack 2666976, win 512, length 0
20:59:14.365486 IP 198.96.84.204.51883 > 165.227.41.79.22: Flags [.], ack 2667796, win 509, length 0
20:59:14.365496 IP 198.96.84.204.51883 > 165.227.41.79.22: Flags [P.], seq 1513:1549, ack 2667796, win 509, length 36
^C
18040 packets captured
18355 packets received by filter