reading from file 0001.pcap, link-type EN10MB (Ethernet)
20:54:09.589245 IP lamp-s-1vcpu-1gb-tor1-01.ssh > 198.96.84.204.51883: Flags [P.], seq 3756718206:3756718250, ack 2364558117, win 315, length 44
20:54:09.589362 IP lamp-s-1vcpu-1gb-tor1-01.ssh > 198.96.84.204.51883: Flags [P.], seq 44:152, ack 1, win 315, length 108
20:54:09.589440 IP lamp-s-1vcpu-1gb-tor1-01.ssh > 198.96.84.204.51883: Flags [P.], seq 152:188, ack 1, win 315, length 36
20:54:09.591882 IP 198.96.84.204.51883 > lamp-s-1vcpu-1gb-tor1-01.ssh: Flags [.], ack 44, win 512, length 0
20:54:09.591923 IP 198.96.84.204.51883 > lamp-s-1vcpu-1gb-tor1-01.ssh: Flags [.], ack 188, win 511, length 0
20:54:12.132214 IP 92.63.196.9.50528 > lamp-s-1vcpu-1gb-tor1-01.25910: Flags [S], seq 149292286, win 1024, length 0
20:54:13.224001 IP 80.82.64.127.45830 > lamp-s-1vcpu-1gb-tor1-01.2256: Flags [S], seq 2607465964, win 1024, length 0
20:54:24.938423 IP 202.200.144.113.46415 > lamp-s-1vcpu-1gb-tor1-01.ms-sql-s: Flags [S], seq 1549635104, win 1024, options [mss 1460], length 0
s