21:00:44.178895 IP lamp-s-1vcpu-1gb-tor1-01.ssh > 198.96.84.204.51883: Flags [P.], seq 2162984:2163156, ack 1189, win 315, length 172
21:00:44.179016 IP lamp-s-1vcpu-1gb-tor1-01.ssh > 198.96.84.204.51883: Flags [P.], seq 2163156:2163328, ack 1189, win 315, length 172
21:00:44.179099 IP lamp-s-1vcpu-1gb-tor1-01.ssh > 198.96.84.204.51883: Flags [P.], seq 2163328:2163500, ack 1189, win 315, length 172
21:00:44.179174 IP lamp-s-1vcpu-1gb-tor1-01.ssh > 198.96.84.204.51883: Flags [P.], seq 2163500:2163672, ack 1189, win 315, length 172
21:00:44.179272 IP lamp-s-1vcpu-1gb-tor1-01.ssh > 198.96.84.204.51883: Flags [P.], seq 2163672:2163844, ack 1189, win 315, length 172
21:00:44.179356 IP lamp-s-1vcpu-1gb-tor1-01.ssh > 198.96.84.204.51883: Flags [P.], seq 2163844:2164016, ack 1189, win 315, length 172
21:00:44.179433 IP lamp-s-1vcpu-1gb-tor1-01.ssh > 198.96.84.204.51883: Flags [P.], seq 2164016:2164188, ack 1189, win 315, length 172
21:00:44.179506 IP lamp-s-1vcpu-1gb-tor1-01.ssh > 198.96.84.204.51883: Flags [P.], seq 2164188:2164360, ack 1189, win 315, length 172
21:00:44.179578 IP lamp-s-1vcpu-1gb-tor1-01.ssh > 198.96.84.204.51883: Flags [P.], seq 2164360:2164532, ack 1189, win 315, length 172
21:00:44.179652 IP lamp-s-1vcpu-1gb-tor1-01.ssh > 198.96.84.204.51883: Flags [P.], seq 2164532:2164704, ack 1189, win 315, length 172
21:00:44.179726 IP lamp-s-1vcpu-1gb-tor1-01.ssh > 198.96.84.204.51883: Flags [P.], seq 2164704:2164876, ack 1189, win 315, length 172
21:00:44.179798 IP lamp-s-1vcpu-1gb-tor1-01.ssh > 198.96.84.204.51883: Flags [P.], seq 2164876:2165048, ack 1189, win 315, length 172
21:00:44.179870 IP lamp-s-1vcpu-1gb-tor1-01.ssh > 198.96.84.204.51883: Flags [P.], seq 2165048:2165220, ack 1189, win 315, length 172
21:00:44.179942 IP lamp-s-1vcpu-1gb-tor1-01.ssh > 198.96.84.204.51883: Flags [P.], seq 2165220:2165392, ack 1189, win 315, length 172
21:00:44.180015 IP lamp-s-1vcpu-1gb-tor1-01.ssh > 198.96.84.204.51883: Flags [P.], seq 2165392:2165564, ack 1189, win 315, length 172
21:00:44.180088 IP lamp-s-1vcpu-1gb-tor1-01.ssh > 198.96.84.204.51883: Flags [P.], seq 2165564:2165736, ack 1189, win 315, length 172
21:00:44.181255 IP 198.96.84.204.51883 > lamp-s-1vcpu-1gb-tor1-01.ssh: Flags [.], ack 2156000, win 509, length 0
21:00:44.181282 IP lamp-s-1vcpu-1gb-tor1-01.ssh > 198.96.84.204.51883: Flags [P.], seq 2165736:2165908, ack 1189, win 315, length 172
21:00:44.181300 IP 198.96.84.204.51883 > lamp-s-1vcpu-1gb-tor1-01.ssh: Flags [.], ack 2157256, win 512, length 0
21:00:44.181307 IP 198.96.84.204.51883 > lamp-s-1vcpu-1gb-tor1-01.ssh: Flags [.], ack 2157944, win 510, length 0
21:00:44.181312 IP 198.96.84.204.51883 > lamp-s-1vcpu-1gb-tor1-01.ssh: Flags [.], ack 2158804, win 512, length 0
21:00:44.181319 IP 198.96.84.204.51883 > lamp-s-1vcpu-1gb-tor1-01.ssh: Flags [.], ack 2160008, win 508, length 0
21:00:44.181325 IP 198.96.84.204.51883 > lamp-s-1vcpu-1gb-tor1-01.ssh: Flags [.], ack 2160868, win 512, length 0
21:00:44.181523 IP lamp-s-1vcpu-1gb-tor1-01.ssh > 198.96.84.204.51883: Flags [P.], seq 2165908:2166768, ack 1189, win 315, length 860
21:00:44.181613 IP lamp-s-1vcpu-1gb-tor1-01.ssh > 198.96.84.204.51883: Flags [P.], seq 2166768:2166940, ack 1189, win 315, length 172
21:00:44.181692 IP lamp-s-1vcpu-1gb-tor1-01.ssh > 198.96.84.204.51883: Flags [P.], seq 2166940:2167112, ack 1189, win 315, length 172
21:00:44.181773 IP lamp-s-1vcpu-1gb-tor1-01.ssh > 198.96.84.204.51883: Flags [P.], seq 2167112:2167284, ack 1189, win 315, length 172
21:00:44.181848 IP lamp-s-1vcpu-1gb-tor1-01.ssh > 198.96.84.204.51883: Flags [P.], seq 2167284:2167456, ack 1189, win 315, length 172
21:00:44.181925 IP lamp-s-1vcpu-1gb-tor1-01.ssh > 198.96.84.204.51883: Flags [P.], seq 2167456:2167628, ack 1189, win 315, length 172
21:00:44.182028 IP lamp-s-1vcpu-1gb-tor1-01.ssh > 198.96.84.204.51883: Flags [P.], seq 2167628:2167800, ack 1189, win 315, length 172
21:00:44.182166 IP lamp-s-1vcpu-1gb-tor1-01.ssh > 198.96.84.204.51883: Flags [P.], seq 2167800:2167972, ack 1189, win 315, length 172
21:00:44.182260 IP lamp-s-1vcpu-1gb-tor1-01.ssh > 198.96.84.204.51883: Flags [P.], seq 2167972:2168144, ack 1189, win 315, length 172
21:00:44.182394 IP lamp-s-1vcpu-1gb-tor1-01.ssh > 198.96.84.204.51883: Flags [P.], seq 2168144:2168316, ack 1189, win 315, length 172
21:00:44.182522 IP lamp-s-1vcpu-1gb-tor1-01.ssh > 198.96.84.204.51883: Flags [P.], seq 2168316:2168488, ack 1189, win 315, length 172
21:00:44.182608 IP lamp-s-1vcpu-1gb-tor1-01.ssh > 198.96.84.204.51883: Flags [P.], seq 2168488:2168660, ack 1189, win 315, length 172
21:00:44.182687 IP lamp-s-1vcpu-1gb-tor1-01.ssh > 198.96.84.204.51883: Flags [P.], seq 2168660:2168832, ack 1189, win 315, length 172
21:00:44.182783 IP lamp-s-1vcpu-1gb-tor1-01.ssh > 198.96.84.204.51883: Flags [P.], seq 2168832:2169004, ack 1189, win 315, length 172
21:00:44.182861 IP lamp-s-1vcpu-1gb-tor1-01.ssh > 198.96.84.204.51883: Flags [P.], seq 2169004:2169176, ack 1189, win 315, length 172
21:00:44.182934 IP lamp-s-1vcpu-1gb-tor1-01.ssh > 198.96.84.204.51883: Flags [P.], seq 2169176:2169348, ack 1189, win 315, length 172
21:00:44.183009 IP lamp-s-1vcpu-1gb-tor1-01.ssh > 198.96.84.204.51883: Flags [P.], seq 2169348:2169520, ack 1189, win 315, length 172
21:00:44.183082 IP lamp-s-1vcpu-1gb-tor1-01.ssh > 198.96.84.204.51883: Flags [P.], seq 2169520:2169692, ack 1189, win 315, length 172
21:00:44.183155 IP lamp-s-1vcpu-1gb-tor1-01.ssh > 198.96.84.204.51883: Flags [P.], seq 2169692:2169864, ack 1189, win 315, length 172
21:00:44.183250 IP lamp-s-1vcpu-1gb-tor1-01.ssh > 198.96.84.204.51883: Flags [P.], seq 2169864:2170036, ack 1189, win 315, length 172
21:00:44.183336 IP lamp-s-1vcpu-1gb-tor1-01.ssh > 198.96.84.204.51883: Flags [P.], seq 2170036:2170208, ack 1189, win 315, length 172
21:00:44.183461 IP lamp-s-1vcpu-1gb-tor1-01.ssh > 198.96.84.204.51883: Flags [P.], seq 2170208:2170380, ack 1189, win 315, length 172
21:00:44.183550 IP lamp-s-1vcpu-1gb-tor1-01.ssh > 198.96.84.204.51883: Flags [P.], seq 2170380:2170552, ack 1189, win 315, length 172
21:00:44.183631 IP lamp-s-1vcpu-1gb-tor1-01.ssh > 198.96.84.204.51883: Flags [P.], seq 2170552:2170724, ack 1189, win 315, length 172
21:00:44.183710 IP lamp-s-1vcpu-1gb-tor1-01.ssh > 198.96.84.204.51883: Flags [P.], seq 2170724:2170896, ack 1189, win 315, length 172
21:00:44.183784 IP lamp-s-1vcpu-1gb-tor1-01.ssh > 198.96.84.204.51883: Flags [P.], seq 2170896:2171068, ack 1189, win 315, length 172
21:00:44.183858 IP lamp-s-1vcpu-1gb-tor1-01.ssh > 198.96.84.204.51883: Flags [P.], seq 2171068:2171240, ack 1189, win 315, length 172
21:00:44.183933 IP lamp-s-1vcpu-1gb-tor1-01.ssh > 198.96.84.204.51883: Flags [P.], seq 2171240:2171412, ack 1189, win 315, length 172
21:00:44.184007 IP lamp-s-1vcpu-1gb-tor1-01.ssh > 198.96.84.204.51883: Flags [P.], seq 2171412:2171584, ack 1189, win 315, length 172
21:00:44.184081 IP lamp-s-1vcpu-1gb-tor1-01.ssh > 198.96.84.204.51883: Flags [P.], seq 2171584:2171756, ack 1189, win 315, length 172
21:00:44.184153 IP lamp-s-1vcpu-1gb-tor1-01.ssh > 198.96.84.204.51883: Flags [P.], seq 2171756:2171928, ack 1189, win 315, length 172
21:00:44.184227 IP lamp-s-1vcpu-1gb-tor1-01.ssh > 198.96.84.204.51883: Flags [P.], seq 2171928:2172100, ack 1189, win 315, length 172
21:00:44.184322 IP lamp-s-1vcpu-1gb-tor1-01.ssh > 198.96.84.204.51883: Flags [P.], seq 2172100:2172272, ack 1189, win 315, length 172
21:00:44.184396 IP lamp-s-1vcpu-1gb-tor1-01.ssh > 198.96.84.204.51883: Flags [P.], seq 2172272:2172444, ack 1189, win 315, length 172
21:00:44.184470 IP lamp-s-1vcpu-1gb-tor1-01.ssh > 198.96.84.204.51883: Flags [P.], seq 2172444:2172616, ack 1189, win 315, length 172
21:00:44.184542 IP lamp-s-1vcpu-1gb-tor1-01.ssh > 198.96.84.204.51883: Flags [P.], seq 2172616:2172788, ack 1189, win 315, length 172
21:00:44.184614 IP lamp-s-1vcpu-1gb-tor1-01.ssh > 198.96.84.204.51883: Flags [P.], seq 2172788:2172960, ack 1189, win 315, length 172
21:00:44.184690 IP lamp-s-1vcpu-1gb-tor1-01.ssh > 198.96.84.204.51883: Flags [P.], seq 2172960:2173132, ack 1189, win 315, length 172
21:00:44.184766 IP lamp-s-1vcpu-1gb-tor1-01.ssh > 198.96.84.204.51883: Flags [P.], seq 2173132:2173304, ack 1189, win 315, length 172
21:00:44.184842 IP lamp-s-1vcpu-1gb-tor1-01.ssh > 198.96.84.204.51883: Flags [P.], seq 2173304:2173476, ack 1189, win 315, length 172
21:00:44.184914 IP lamp-s-1vcpu-1gb-tor1-01.ssh > 198.96.84.204.51883: Flags [P.], seq 2173476:2173648, ack 1189, win 315, length 172
21:00:44.184987 IP lamp-s-1vcpu-1gb-tor1-01.ssh > 198.96.84.204.51883: Flags [P.], seq 2173648:2173820, ack 1189, win 315, length 172
21:00:44.186205 IP 198.96.84.204.51883 > lamp-s-1vcpu-1gb-tor1-01.ssh: Flags [.], ack 2164532, win 509, length 0
21:00:44.186234 IP lamp-s-1vcpu-1gb-tor1-01.ssh > 198.96.84.204.51883: Flags [P.], seq 2173820:2173992, ack 1189, win 315, length 172
21:00:44.186252 IP 198.96.84.204.51883 > lamp-s-1vcpu-1gb-tor1-01.ssh: Flags [.], ack 2165736, win 512, length 0
21:00:44.186260 IP 198.96.84.204.51883 > lamp-s-1vcpu-1gb-tor1-01.ssh: Flags [.], ack 2165908, win 512, length 0
21:00:44.186265 IP 198.96.84.204.51883 > lamp-s-1vcpu-1gb-tor1-01.ssh: Flags [P.], seq 1189:1225, ack 2166768, win 508, length 36
21:00:44.186273 IP 198.96.84.204.51883 > lamp-s-1vcpu-1gb-tor1-01.ssh: Flags [.], ack 2168832, win 512, length 0
21:00:44.186280 IP 198.96.84.204.51883 > lamp-s-1vcpu-1gb-tor1-01.ssh: Flags [.], ack 2169864, win 508, length 0
^C
13444 packets captured
13561 packets received by filter